<?xml version="1.0" encoding="UTF-8" standalone="no"?>
<!DOCTYPE projector SYSTEM "projector.dtd">
<projector>
  <project>
    <rootElement>projector</rootElement>
    <rootObject>Projector</rootObject>
    <name>Projector</name>
    <projectPackage>ca.brood.projector</projectPackage>
  </project>
  <object>
    <name>Projector</name>
    <reference>
      <name>project</name>
      <targetType>ProjectorProject</targetType>
      <relationship>onetoone</relationship>
      <elementName>project</elementName>
    </reference>
    <reference>
      <name>projectObjects</name>
      <targetType>ProjectorObject</targetType>
      <relationship>onetomany</relationship>
      <elementName>object</elementName>
    </reference>
  </object>
  <object>
    <name>ProjectorProject</name>
    <field>
      <name>rootElement</name>
      <type>string</type>
      <size>512</size>
      <elementName>rootElement</elementName>
    </field>
    <field>
      <name>rootObject</name>
      <type>string</type>
      <size>512</size>
      <elementName>rootObject</elementName>
    </field>
    <field>
      <name>name</name>
      <type>string</type>
      <size>512</size>
      <elementName>name</elementName>
    </field>
    <field>
      <name>projectPackage</name>
      <type>string</type>
      <size>512</size>
      <elementName>projectPackage</elementName>
    </field>
  </object>
  <object>
    <name>ProjectorObject</name>
    <field>
      <name>name</name>
      <type>string</type>
      <size>255</size>
      <elementName>name</elementName>
    </field>
    <field>
      <name>superclass</name>
      <type>string</type>
      <size>255</size>
      <elementName>superclass</elementName>
    </field>
    <reference>
      <name>fields</name>
      <targetType>ProjectorField</targetType>
      <relationship>onetomany</relationship>
      <elementName>field</elementName>
    </reference>
    <reference>
      <name>references</name>
      <targetType>ProjectorReference</targetType>
      <relationship>onetomany</relationship>
      <elementName>reference</elementName>
    </reference>
  </object>
  <object>
    <name>ProjectorField</name>
    <field>
      <name>name</name>
      <type>string</type>
      <size>255</size>
      <elementName>name</elementName>
    </field>
    <field>
      <name>type</name>
      <type>string</type>
      <size>32</size>
      <elementName>type</elementName>
    </field>
    <field>
      <name>size</name>
      <type>integer</type>
      <size>4</size>
      <elementName>size</elementName>
    </field>
    <field>
      <name>elementName</name>
      <type>string</type>
      <size>255</size>
      <elementName>elementName</elementName>
    </field>
  </object>
  <object>
    <name>SubclassType</name>
    <field>
      <name>elementName</name>
      <type>string</type>
      <size>255</size>
      <elementName>elementName</elementName>
    </field>
    <field>
      <name>targetType</name>
      <type>string</type>
      <size>255</size>
      <elementName>targetType</elementName>
    </field>
  </object>
  <object>
    <name>ProjectorReference</name>
    <field>
      <name>name</name>
      <type>string</type>
      <size>255</size>
      <elementName>name</elementName>
    </field>
    <field>
      <name>targetType</name>
      <type>string</type>
      <size>255</size>
      <elementName>targetType</elementName>
    </field>
    <field>
      <name>relationship</name>
      <type>string</type>
      <size>255</size>
      <elementName>relationship</elementName>
    </field>
    <field>
      <name>elementName</name>
      <type>string</type>
      <size>255</size>
      <elementName>elementName</elementName>
    </field>
    <reference>
      <name>subclassTypes</name>
      <targetType>SubclassType</targetType>
      <relationship>onetomany</relationship>
      <elementName>subclassType</elementName>
    </reference>
  </object>
</projector>
