<?xml version="1.0" encoding="UTF-8" standalone="no"?>
<!--
  Copyright (c) 2015 Charles Hache <chalz@member.fsf.org>. All rights reserved. 
  
  This file is part of the projector project.
  projector is free software: you can redistribute it and/or modify
  it under the terms of the GNU General Public License as published by
  the Free Software Foundation, either version 3 of the License, or
  (at your option) any later version.
  
  projector is distributed in the hope that it will be useful,
  but WITHOUT ANY WARRANTY; without even the implied warranty of
  MERCHANTABILITY or FITNESS FOR A PARTICULAR PURPOSE.  See the 
  GNU General Public License for more details.
  
  You should have received a copy of the GNU General Public License
  along with projector.  If not, see <http://www.gnu.org/licenses/>.
  
  Contributors:
      Charles Hache <chalz@member.fsf.org> - initial API and implementation
-->
<!DOCTYPE projector SYSTEM "projector.dtd">
<projector>
  <project>
    <name>Projector</name>
    <projectPackage>ca.brood.projector</projectPackage>
    <rootElement>projector</rootElement>
    <rootObject>Projector</rootObject>
  </project>
  <object>
    <name>Projector</name>
    <reference>
      <name>project</name>
      <elementName>project</elementName>
      <targetType>ProjectorProject</targetType>
      <relationship>onetoone</relationship>
    </reference>
    <reference>
      <name>projectObjects</name>
      <elementName>object</elementName>
      <targetType>ProjectorObject</targetType>
      <relationship>onetomany</relationship>
    </reference>
  </object>
  <object>
    <name>ProjectorProject</name>
    <field>
      <name>name</name>
      <elementName>name</elementName>
      <type>string</type>
      <size>512</size>
    </field>
    <field>
      <name>projectPackage</name>
      <elementName>projectPackage</elementName>
      <type>string</type>
      <size>512</size>
    </field>
    <field>
      <name>rootElement</name>
      <elementName>rootElement</elementName>
      <type>string</type>
      <size>512</size>
    </field>
    <field>
      <name>rootObject</name>
      <elementName>rootObject</elementName>
      <type>string</type>
      <size>512</size>
    </field>
  </object>
  <object>
    <name>ProjectorObject</name>
    <field>
      <name>name</name>
      <elementName>name</elementName>
      <type>string</type>
      <size>255</size>
    </field>
    <field>
      <name>superclass</name>
      <elementName>superclass</elementName>
      <type>string</type>
      <size>255</size>
	  <options>
		<option>optional</option>
	  </options>
    </field>
    <reference>
      <name>fields</name>
      <elementName>field</elementName>
      <targetType>ProjectorField</targetType>
      <relationship>onetomany</relationship>
    </reference>
    <reference>
      <name>references</name>
      <elementName>reference</elementName>
      <targetType>ProjectorReference</targetType>
      <relationship>onetomany</relationship>
    </reference>
  </object>
  <object>
    <name>ProjectorField</name>
    <field>
      <name>name</name>
      <elementName>name</elementName>
      <type>string</type>
      <size>255</size>
    </field>
    <field>
      <name>elementName</name>
      <elementName>elementName</elementName>
      <type>string</type>
      <size>255</size>
	  <options>
		<option>optional</option>
	  </options>
    </field>
    <field>
      <name>type</name>
      <elementName>type</elementName>
      <type>string</type>
      <size>32</size>
    </field>
    <field>
      <name>size</name>
      <elementName>size</elementName>
      <type>integer</type>
      <size>4</size>
    </field>
    <reference>
      <name>options</name>
      <elementName>options</elementName>
      <targetType>ProjectorOptions</targetType>
      <relationship>onetoone</relationship>
	  <options>
		<option>optional</option>
	  </options>
    </reference>
  </object>
  <object>
	<name>ProjectorOptions</name>
	<field>
		<name>options</name>
		<elementName>option</elementName>
		<type>string</type>
		<size>255</size>
		<options>
			<option>multiple</option>
		</options>
	</field>
  </object>
  <object>
    <name>SubclassType</name>
    <field>
      <name>elementName</name>
      <elementName>elementName</elementName>
      <type>string</type>
      <size>255</size>
    </field>
    <field>
      <name>targetType</name>
      <elementName>targetType</elementName>
      <type>string</type>
      <size>255</size>
    </field>
  </object>
  <object>
    <name>ProjectorReference</name>
    <field>
      <name>name</name>
      <elementName>name</elementName>
      <type>string</type>
      <size>255</size>
    </field>
    <field>
      <name>elementName</name>
      <elementName>elementName</elementName>
      <type>string</type>
      <size>255</size>
    </field>
    <field>
      <name>targetType</name>
      <elementName>targetType</elementName>
      <type>string</type>
      <size>255</size>
    </field>
    <field>
      <name>relationship</name>
      <elementName>relationship</elementName>
      <type>string</type>
      <size>255</size>
    </field>
    <reference>
      <name>subclassTypes</name>
      <elementName>subclassType</elementName>
      <targetType>SubclassType</targetType>
      <relationship>onetomany</relationship>
    </reference>
	<reference>
      <name>options</name>
      <targetType>ProjectorOptions</targetType>
      <relationship>onetoone</relationship>
	  <options>
		<option>optional</option>
	  </options>
    </reference>
  </object>
</projector>
