<?xml version="1.0" encoding="UTF-8" standalone="no"?>
<!DOCTYPE projector SYSTEM "projector.dtd">
<projector>
  <project>
    <rootElement>softlogger</rootElement>
    <rootObject>Softlogger</rootObject>
    <name>Softlogger</name>
    <projectPackage>ca.brood.softlogger</projectPackage>
  </project>
  <object>
    <name>Softlogger</name>
    <field>
      <name>name</name>
      <type>string</type>
      <size>255</size>
      <elementName>name</elementName>
    </field>
    <field>
      <name>poll</name>
      <type>integer</type>
      <size>4</size>
      <elementName>poll</elementName>
    </field>
    <field>
      <name>tableFilePath</name>
      <type>string</type>
      <size>255</size>
      <elementName>tableFilePath</elementName>
    </field>
    <field>
      <name>dataFilePath</name>
      <type>string</type>
      <size>255</size>
      <elementName>dataFilePath</elementName>
    </field>
    <reference>
      <name>dataServer</name>
      <targetType>DataServer</targetType>
      <relationship>onetoone</relationship>
      <elementName>server</elementName>
    </reference>
    <reference>
      <name>softloggerChannels</name>
      <targetType>SoftloggerChannel</targetType>
      <relationship>onetomany</relationship>
      <elementName>channel</elementName>
    </reference>
  </object>
  <object>
    <name>DataServer</name>
    <field>
      <name>user</name>
      <type>string</type>
      <size>255</size>
      <elementName>user</elementName>
    </field>
    <field>
      <name>host</name>
      <type>string</type>
      <size>255</size>
      <elementName>host</elementName>
    </field>
    <field>
      <name>password</name>
      <type>string</type>
      <size>255</size>
      <elementName>password</elementName>
    </field>
    <field>
      <name>keyfile</name>
      <type>string</type>
      <size>255</size>
      <elementName>keyfile</elementName>
    </field>
    <field>
      <name>configPoll</name>
      <type>integer</type>
      <size>4</size>
      <elementName>configPoll</elementName>
    </field>
    <field>
      <name>path</name>
      <type>string</type>
      <size>255</size>
      <elementName>path</elementName>
    </field>
  </object>
  <object>
    <name>SoftloggerChannel</name>
    <reference>
      <name>modbusChannel</name>
      <targetType>ModbusChannel</targetType>
      <relationship>onetoone</relationship>
      <elementName>modbusChannel</elementName>
      <subclassType>
        <elementName>tcp</elementName>
        <targetType>ModbusTcpChannel</targetType>
      </subclassType>
    </reference>
  </object>
  <object>
    <name>ModbusChannel</name>
    <field>
      <name>poll</name>
      <type>integer</type>
      <size>4</size>
      <elementName>poll</elementName>
    </field>
  </object>
  <object>
    <name>ModbusTcpChannel</name>
    <superclass>ModbusChannel</superclass>
    <field>
      <name>host</name>
      <type>string</type>
      <size>255</size>
      <elementName>host</elementName>
    </field>
    <field>
      <name>port</name>
      <type>integer</type>
      <size>2</size>
      <elementName>port</elementName>
    </field>
  </object>
</projector>
